{
  "schema_version": "1.0.0",
  "environment": "demo",
  "generated_at": "2026-10-02T18:00:00Z",
  "expires_at": "2026-12-31T23:59:59Z",
  "source": {
    "name": "Catálogo sintético do protótipo",
    "public_url": "https://planassiste.mpu.mp.br/beneficiarios/conheca-o-plano/rede-credenciada",
    "plan_id": 639,
    "plan_name": "PLAN ASSISTE (MPU) — referência de demonstração"
  },
  "authorization": {
    "status": "synthetic-demo",
    "reference": null
  },
  "record_count": 24,
  "records": [
    {
      "public_id": "profissional-demo-001",
      "type": "professional",
      "display_name": "Profissional demonstrativo 01",
      "professional_registry": { "council": "CRM", "state": "DF", "number": "DEMO-1001" },
      "specialties": [
        { "name": "Cardiologia", "rqe": "DEMO-2001" },
        { "name": "Clínica médica", "rqe": "DEMO-2002" }
      ],
      "service_locations": [
        {
          "facility_public_id": "estabelecimento-demo-001",
          "facility_name": "Centro Clínico Modelo Asa Sul",
          "phones": ["(61) 0000-0101"],
          "address": { "street": "Endereço demonstrativo 101", "district": "Asa Sul", "city": "Brasília", "state": "DF" }
        },
        {
          "facility_public_id": "estabelecimento-demo-004",
          "facility_name": "Unidade Modelo Águas Claras",
          "phones": ["(61) 0000-0401"],
          "address": { "street": "Endereço demonstrativo 401", "district": "Águas Claras", "city": "Brasília", "state": "DF" }
        }
      ],
      "source_updated_at": "2026-10-02T18:00:00Z"
    },
    {
      "public_id": "profissional-demo-002",
      "type": "professional",
      "display_name": "Profissional demonstrativo 02",
      "professional_registry": { "council": "CRM", "state": "DF", "number": "DEMO-1002" },
      "specialties": [{ "name": "Cardiologia", "rqe": "DEMO-2003" }],
      "service_locations": [
        {
          "facility_public_id": "estabelecimento-demo-002",
          "facility_name": "Clínica Modelo Asa Norte",
          "phones": ["(61) 0000-0201"],
          "address": { "street": "Endereço demonstrativo 201", "district": "Asa Norte", "city": "Brasília", "state": "DF" }
        }
      ],
      "source_updated_at": "2026-10-02T18:00:00Z"
    },
    {
      "public_id": "profissional-demo-003",
      "type": "professional",
      "display_name": "Profissional demonstrativo 03",
      "professional_registry": { "council": "CRM", "state": "DF", "number": "DEMO-1003" },
      "specialties": [{ "name": "Ortopedia", "rqe": "DEMO-2004" }],
      "service_locations": [
        {
          "facility_public_id": "estabelecimento-demo-003",
          "facility_name": "Instituto Modelo Taguatinga",
          "phones": ["(61) 0000-0301"],
          "address": { "street": "Endereço demonstrativo 301", "district": "Taguatinga", "city": "Brasília", "state": "DF" }
        }
      ],
      "source_updated_at": "2026-10-02T18:00:00Z"
    },
    {
      "public_id": "profissional-demo-004",
      "type": "professional",
      "display_name": "Profissional demonstrativo 04",
      "professional_registry": { "council": "CRM", "state": "DF", "number": "DEMO-1004" },
      "specialties": [
        { "name": "Ortopedia", "rqe": "DEMO-2005" },
        { "name": "Medicina esportiva", "rqe": "DEMO-2006" }
      ],
      "service_locations": [
        {
          "facility_public_id": "estabelecimento-demo-005",
          "facility_name": "Centro Assistencial Modelo Guará",
          "phones": ["(61) 0000-0501"],
          "address": { "street": "Endereço demonstrativo 501", "district": "Guará", "city": "Brasília", "state": "DF" }
        }
      ],
      "source_updated_at": "2026-10-02T18:00:00Z"
    },
    {
      "public_id": "profissional-demo-005",
      "type": "professional",
      "display_name": "Profissional demonstrativo 05",
      "professional_registry": { "council": "CRM", "state": "DF", "number": "DEMO-1005" },
      "specialties": [{ "name": "Ginecologia", "rqe": "DEMO-2007" }],
      "service_locations": [
        {
          "facility_public_id": "estabelecimento-demo-001",
          "facility_name": "Centro Clínico Modelo Asa Sul",
          "phones": ["(61) 0000-0102"],
          "address": { "street": "Endereço demonstrativo 101", "district": "Asa Sul", "city": "Brasília", "state": "DF" }
        }
      ],
      "source_updated_at": "2026-10-02T18:00:00Z"
    },
    {
      "public_id": "profissional-demo-006",
      "type": "professional",
      "display_name": "Profissional demonstrativo 06",
      "professional_registry": { "council": "CRM", "state": "DF", "number": "DEMO-1006" },
      "specialties": [
        { "name": "Ginecologia", "rqe": "DEMO-2008" },
        { "name": "Obstetrícia", "rqe": "DEMO-2009" }
      ],
      "service_locations": [
        {
          "facility_public_id": "estabelecimento-demo-004",
          "facility_name": "Unidade Modelo Águas Claras",
          "phones": ["(61) 0000-0402"],
          "address": { "street": "Endereço demonstrativo 401", "district": "Águas Claras", "city": "Brasília", "state": "DF" }
        }
      ],
      "source_updated_at": "2026-10-02T18:00:00Z"
    },
    {
      "public_id": "profissional-demo-007",
      "type": "professional",
      "display_name": "Profissional demonstrativo 07",
      "professional_registry": { "council": "CRM", "state": "DF", "number": "DEMO-1007" },
      "specialties": [{ "name": "Pediatria", "rqe": "DEMO-2010" }],
      "service_locations": [
        {
          "facility_public_id": "estabelecimento-demo-002",
          "facility_name": "Clínica Modelo Asa Norte",
          "phones": ["(61) 0000-0202"],
          "address": { "street": "Endereço demonstrativo 201", "district": "Asa Norte", "city": "Brasília", "state": "DF" }
        }
      ],
      "source_updated_at": "2026-10-02T18:00:00Z"
    },
    {
      "public_id": "profissional-demo-008",
      "type": "professional",
      "display_name": "Profissional demonstrativo 08",
      "professional_registry": { "council": "CRM", "state": "DF", "number": "DEMO-1008" },
      "specialties": [
        { "name": "Pediatria", "rqe": "DEMO-2011" },
        { "name": "Alergia e imunologia", "rqe": "DEMO-2012" }
      ],
      "service_locations": [
        {
          "facility_public_id": "estabelecimento-demo-006",
          "facility_name": "Policlínica Modelo Sobradinho",
          "phones": ["(61) 0000-0601"],
          "address": { "street": "Endereço demonstrativo 601", "district": "Sobradinho", "city": "Brasília", "state": "DF" }
        }
      ],
      "source_updated_at": "2026-10-02T18:00:00Z"
    },
    {
      "public_id": "profissional-demo-009",
      "type": "professional",
      "display_name": "Profissional demonstrativo 09",
      "professional_registry": { "council": "CRM", "state": "DF", "number": "DEMO-1009" },
      "specialties": [{ "name": "Dermatologia", "rqe": "DEMO-2013" }],
      "service_locations": [
        {
          "facility_public_id": "estabelecimento-demo-001",
          "facility_name": "Centro Clínico Modelo Asa Sul",
          "phones": ["(61) 0000-0103"],
          "address": { "street": "Endereço demonstrativo 101", "district": "Asa Sul", "city": "Brasília", "state": "DF" }
        }
      ],
      "source_updated_at": "2026-10-02T18:00:00Z"
    },
    {
      "public_id": "profissional-demo-010",
      "type": "professional",
      "display_name": "Profissional demonstrativo 10",
      "professional_registry": { "council": "CRM", "state": "DF", "number": "DEMO-1010" },
      "specialties": [{ "name": "Oftalmologia", "rqe": "DEMO-2014" }],
      "service_locations": [
        {
          "facility_public_id": "estabelecimento-demo-003",
          "facility_name": "Instituto Modelo Taguatinga",
          "phones": ["(61) 0000-0302"],
          "address": { "street": "Endereço demonstrativo 301", "district": "Taguatinga", "city": "Brasília", "state": "DF" }
        }
      ],
      "source_updated_at": "2026-10-02T18:00:00Z"
    },
    {
      "public_id": "profissional-demo-011",
      "type": "professional",
      "display_name": "Profissional demonstrativo 11",
      "professional_registry": { "council": "CRM", "state": "DF", "number": "DEMO-1011" },
      "specialties": [{ "name": "Endocrinologia", "rqe": "DEMO-2015" }],
      "service_locations": [
        {
          "facility_public_id": "estabelecimento-demo-004",
          "facility_name": "Unidade Modelo Águas Claras",
          "phones": ["(61) 0000-0403"],
          "address": { "street": "Endereço demonstrativo 401", "district": "Águas Claras", "city": "Brasília", "state": "DF" }
        }
      ],
      "source_updated_at": "2026-10-02T18:00:00Z"
    },
    {
      "public_id": "profissional-demo-012",
      "type": "professional",
      "display_name": "Profissional demonstrativo 12",
      "professional_registry": { "council": "CRM", "state": "DF", "number": "DEMO-1012" },
      "specialties": [
        { "name": "Neurologia", "rqe": "DEMO-2016" },
        { "name": "Clínica médica", "rqe": "DEMO-2017" }
      ],
      "service_locations": [
        {
          "facility_public_id": "estabelecimento-demo-002",
          "facility_name": "Clínica Modelo Asa Norte",
          "phones": ["(61) 0000-0203"],
          "address": { "street": "Endereço demonstrativo 201", "district": "Asa Norte", "city": "Brasília", "state": "DF" }
        }
      ],
      "source_updated_at": "2026-10-02T18:00:00Z"
    },
    {
      "public_id": "profissional-demo-013",
      "type": "professional",
      "display_name": "Profissional demonstrativo 13",
      "professional_registry": { "council": "CRP", "state": "DF", "number": "DEMO-3013" },
      "specialties": [{ "name": "Psicologia", "rqe": null }],
      "service_locations": [
        {
          "facility_public_id": "estabelecimento-demo-005",
          "facility_name": "Centro Assistencial Modelo Guará",
          "phones": ["(61) 0000-0502"],